{
  "$schema": "https://json-schema.org/draft/2020-12/schema",
  "title": "Slime route v1",
  "type": "object",
  "properties": {
    "format": {
      "const": "slime-route/1"
    },
    "identity": {
      "$ref": "urn:slime:schema:common#/$defs/key"
    },
    "sequence": {
      "type": "integer",
      "minimum": 1,
      "maximum": 9007199254740991
    },
    "issued_at": {
      "$ref": "urn:slime:schema:common#/$defs/time"
    },
    "homeservers": {
      "type": "array",
      "minItems": 1,
      "maxItems": 8,
      "uniqueItems": true,
      "items": {
        "$ref": "urn:slime:schema:common#/$defs/key"
      }
    },
    "failover": {
      "type": "object",
      "properties": {
        "key": {
          "$ref": "urn:slime:schema:common#/$defs/key"
        },
        "expires_at": {
          "$ref": "urn:slime:schema:common#/$defs/time"
        }
      },
      "required": [
        "key",
        "expires_at"
      ],
      "additionalProperties": false
    },
    "notice": {
      "type": "array",
      "maxItems": 8,
      "uniqueItems": true,
      "items": {
        "$ref": "urn:slime:schema:common#/$defs/key"
      }
    },
    "mirrors": {
      "type": "array",
      "maxItems": 8,
      "uniqueItems": true,
      "items": {
        "$ref": "urn:slime:schema:common#/$defs/key"
      }
    },
    "providers": {
      "type": "array",
      "maxItems": 8,
      "uniqueItems": true,
      "items": {
        "$ref": "urn:slime:schema:common#/$defs/key"
      }
    }
  },
  "required": [
    "format",
    "identity",
    "sequence",
    "issued_at",
    "homeservers"
  ],
  "additionalProperties": false
}
